{
  "schema_version": "1.0",
  "generated_at": "2026-04-10T20:15:25Z",
  "myflames_version": "1.2.0",
  "source": {
    "type": "live",
    "engine": "mysql",
    "engine_version": "8.4.8"
  },
  "plan_summary": {
    "total_time_ms": 1.806,
    "rows_sent": 5,
    "rows_examined_estimate": 3000,
    "operator_count": 6,
    "max_depth": 6
  },
  "optimizer_switches": [
    {
      "name": "materialization",
      "value": "on",
      "explanation": "A subquery or derived table is executed once and its result stored in a temporary table for reuse. Watch tmp_table_size / max_heap_table_size — it may spill to disk.",
      "node_labels": [
        "Materialize"
      ]
    }
  ],
  "warnings": [
    {
      "severity": "warn",
      "category": "full_scan",
      "text": "Full table scan: t (5 rows)",
      "source": "plan",
      "node_labels": [
        "Table scan [t]"
      ]
    },
    {
      "severity": "warn",
      "category": "temp_table",
      "text": "1 temp table(s) (Materialize) — up to 5 rows; may spill to disk",
      "source": "plan",
      "node_labels": [
        "Materialize"
      ]
    },
    {
      "severity": "warn",
      "category": "filesort",
      "text": "1 sort operation(s) — 5 rows; may use disk-based filesort",
      "source": "plan",
      "node_labels": [
        "Sort"
      ]
    },
    {
      "severity": "warn",
      "category": "env",
      "text": "Filesort detected but sort_buffer_size is only 256.0 KB — the sort will likely spill to disk.",
      "source": "environment"
    },
    {
      "severity": "warn",
      "category": "env",
      "text": "Query materializes 1 temp table(s) but tmp_table_size/max_heap_table_size is capped at 16.0 MB — temp tables will spill to InnoDB disk tables.",
      "source": "environment"
    }
  ],
  "suggestions": [
    {
      "severity": "high",
      "category": "index",
      "action": "Add indexes on filter/join columns to avoid full table scans",
      "source": "plan"
    },
    {
      "severity": "medium",
      "category": "tuning_variable",
      "action": "Increase tmp_table_size / max_heap_table_size to keep temp tables in memory",
      "source": "plan",
      "target_variable": "tmp_table_size"
    },
    {
      "severity": "medium",
      "category": "tuning_variable",
      "action": "Increase sort_buffer_size or add an ordered index to avoid filesort",
      "source": "plan",
      "target_variable": "sort_buffer_size"
    },
    {
      "severity": "medium",
      "category": "tuning_variable",
      "action": "Raise sort_buffer_size to 2M–8M for this session (SET SESSION sort_buffer_size = 8*1024*1024).",
      "source": "environment",
      "why": "when the sort set does not fit in sort_buffer_size, MySQL writes multiple sorted runs to tmpdir and merges them back — that is real disk I/O plus a k-way merge. A buffer big enough to hold the result stays in memory and uses the faster in-RAM sort. Caveat: sort_buffer_size is allocated per-connection, so set it per-session rather than globally to avoid multiplying RAM cost across all threads.",
      "target_variable": "sort_buffer_size"
    },
    {
      "severity": "medium",
      "category": "tuning_variable",
      "action": "Raise tmp_table_size AND max_heap_table_size together to the same value (64M–256M).",
      "source": "environment",
      "why": "once a materialized temp table exceeds min(tmp_table_size, max_heap_table_size), MySQL converts the in-memory MEMORY/TempTable engine to an on-disk InnoDB temp table — scans over the disk version are typically 10–100× slower and generate real I/O. Both variables must be raised together because MySQL always picks the smaller of the two; raising only one has no effect.",
      "target_variable": "tmp_table_size"
    }
  ],
  "executive_summary": "Query scans 1 table, materializes 1 temp table and sorts the result; examines ~3,000 rows to return 5 in 1.8 ms. Main finding: the sort will likely spill to disk because sort_buffer_size is too small.",
  "query": {
    "raw": "SELECT t.country, t.cnt FROM (SELECT country, COUNT(*) cnt FROM users WHERE status='active' GROUP BY country) t ORDER BY t.cnt DESC",
    "beautified": "SELECT t.country, t.cnt\nFROM (\nSELECT country, COUNT(*) cnt\nFROM users\nWHERE status='active'\nGROUP BY country) t\nORDER BY t.cnt DESC"
  },
  "primary_action": {
    "ref": "suggestions[0]"
  },
  "collected": {
    "variables": {
      "bulk_insert_buffer_size": "8388608",
      "character_set_connection": "utf8mb4",
      "character_set_server": "utf8mb4",
      "collation_connection": "utf8mb4_0900_ai_ci",
      "collation_server": "utf8mb4_0900_ai_ci",
      "eq_range_index_dive_limit": "200",
      "innodb_buffer_pool_instances": "1",
      "innodb_buffer_pool_size": "134217728",
      "innodb_file_per_table": "ON",
      "innodb_flush_log_at_trx_commit": "1",
      "innodb_flush_method": "O_DIRECT",
      "innodb_io_capacity": "10000",
      "innodb_log_buffer_size": "67108864",
      "innodb_log_file_size": "50331648",
      "join_buffer_size": "262144",
      "max_allowed_packet": "67108864",
      "max_connections": "151",
      "max_heap_table_size": "16777216",
      "optimizer_prune_level": "1",
      "optimizer_search_depth": "62",
      "optimizer_switch": "index_merge=on,index_merge_union=on,index_merge_sort_union=on,index_merge_intersection=on,engine_condition_pushdown=on,index_condition_pushdown=on,mrr=on,mrr_cost_based=on,block_nested_loop=on,batched_key_access=off,materialization=on,semijoin=on,loosescan=on,firstmatch=on,duplicateweedout=on,subquery_materialization_cost_based=on,use_index_extensions=on,condition_fanout_filter=on,derived_merge=on,use_invisible_indexes=off,skip_scan=on,hash_join=on,subquery_to_derived=off,prefer_ordering_index=on,hypergraph_optimizer=off,derived_condition_pushdown=on,hash_set_operations=on",
      "range_optimizer_max_mem_size": "8388608",
      "read_buffer_size": "131072",
      "read_rnd_buffer_size": "262144",
      "sort_buffer_size": "262144",
      "table_open_cache": "4000",
      "thread_cache_size": "9",
      "tmp_table_size": "16777216",
      "version": "8.4.8",
      "version_comment": "MySQL Community Server - GPL",
      "version_compile_os": "Linux"
    },
    "stats": {
      "demodb.users": {
        "table_schema": "demodb",
        "table_name": "users",
        "table_rows": 3000,
        "data_length": 180224,
        "index_length": 81920,
        "data_free": 0,
        "auto_increment": 4096,
        "engine": "InnoDB",
        "row_format": "Dynamic"
      }
    },
    "schema": {
      "demodb.users": {
        "ddl": "CREATE TABLE `users` (\n  `id` int NOT NULL AUTO_INCREMENT,\n  `name` varchar(80) DEFAULT NULL,\n  `country` varchar(2) DEFAULT NULL,\n  `status` varchar(20) DEFAULT NULL,\n  `created_at` datetime DEFAULT NULL,\n  PRIMARY KEY (`id`),\n  KEY `idx_country` (`country`)\n) ENGINE=InnoDB AUTO_INCREMENT=4096 DEFAULT CHARSET=utf8mb4 COLLATE=utf8mb4_0900_ai_ci",
        "table_name": "users",
        "columns": [
          {
            "name": "id",
            "type": "int",
            "rest": "NOT NULL AUTO_INCREMENT"
          },
          {
            "name": "name",
            "type": "varchar(80)",
            "rest": "DEFAULT NULL"
          },
          {
            "name": "country",
            "type": "varchar(2)",
            "rest": "DEFAULT NULL"
          },
          {
            "name": "status",
            "type": "varchar(20)",
            "rest": "DEFAULT NULL"
          },
          {
            "name": "created_at",
            "type": "datetime",
            "rest": "DEFAULT NULL"
          }
        ],
        "indexes": [
          {
            "kind": "PRIMARY KEY",
            "name": null,
            "columns": [
              "id"
            ]
          },
          {
            "kind": "KEY",
            "name": "idx_country",
            "columns": [
              "country"
            ]
          }
        ],
        "engine": "InnoDB",
        "charset": "utf8mb4"
      }
    }
  }
}
