{
  "schema_version": "1.0",
  "generated_at": "2026-04-10T20:09:16Z",
  "myflames_version": "1.2.0",
  "source": {
    "type": "file",
    "engine": "mysql",
    "fixture_path": "test/fixtures/explain-001-table-scan-users-no-filter.json"
  },
  "plan_summary": {
    "total_time_ms": 0.441,
    "rows_sent": 3000,
    "rows_examined_estimate": 3000,
    "operator_count": 1,
    "max_depth": 1
  },
  "optimizer_switches": [],
  "warnings": [
    {
      "severity": "warn",
      "category": "full_scan",
      "text": "Full table scan: users (3000 rows)",
      "source": "plan",
      "node_labels": [
        "Table scan [users]"
      ]
    }
  ],
  "suggestions": [
    {
      "severity": "high",
      "category": "index",
      "action": "Add indexes on filter/join columns to avoid full table scans",
      "source": "plan"
    }
  ],
  "executive_summary": "Query scans 1 table; returns 3,000 rows in 0.44 ms. Main finding: full scan of users (3,000 rows).",
  "query": {
    "raw": "/* select#1 */ select `testdb`.`users`.`id` AS `id`,`testdb`.`users`.`name` AS `name`,`testdb`.`users`.`email` AS `email`,`testdb`.`users`.`country` AS `country`,`testdb`.`users`.`created_at` AS `created_at` from `testdb`.`users`",
    "beautified": "select testdb.users.id AS id,testdb.users.name AS name,testdb.users.email AS email,testdb.users.country AS country,testdb.users.created_at AS created_at\nfrom testdb.users"
  },
  "primary_action": {
    "ref": "suggestions[0]"
  }
}
