{
  "schema_version": "1.0",
  "generated_at": "2026-04-10T20:09:21Z",
  "myflames_version": "1.2.0",
  "source": {
    "type": "file",
    "engine": "mysql",
    "fixture_path": "test/mysql-explain-complex-cte-window.json"
  },
  "plan_summary": {
    "total_time_ms": 3.79,
    "rows_sent": 24,
    "rows_examined_estimate": 4008,
    "operator_count": 15,
    "max_depth": 10
  },
  "optimizer_switches": [
    {
      "name": "materialization",
      "value": "on",
      "explanation": "A subquery or derived table is executed once and its result stored in a temporary table for reuse. Watch tmp_table_size / max_heap_table_size â€” it may spill to disk.",
      "node_labels": [
        "Materialize"
      ]
    }
  ],
  "warnings": [
    {
      "severity": "warn",
      "category": "full_scan",
      "text": "Full table scan: departments (8 rows), employees (2000 rows)",
      "source": "plan",
      "node_labels": [
        "Table scan [departments]",
        "Table scan [employees]"
      ]
    },
    {
      "severity": "warn",
      "category": "temp_table",
      "text": "2 temp table(s) (Materialize) â€” up to 2000 rows; may spill to disk",
      "source": "plan",
      "node_labels": [
        "Materialize"
      ]
    },
    {
      "severity": "warn",
      "category": "filesort",
      "text": "2 sort operation(s) â€” 2000 rows; may use disk-based filesort",
      "source": "plan",
      "node_labels": [
        "Sort"
      ]
    }
  ],
  "suggestions": [
    {
      "severity": "high",
      "category": "index",
      "action": "Add indexes on filter/join columns to avoid full table scans",
      "source": "plan"
    },
    {
      "severity": "medium",
      "category": "tuning_variable",
      "action": "Increase tmp_table_size / max_heap_table_size to keep temp tables in memory",
      "source": "plan",
      "target_variable": "tmp_table_size"
    },
    {
      "severity": "medium",
      "category": "tuning_variable",
      "action": "Increase sort_buffer_size or add an ordered index to avoid filesort",
      "source": "plan",
      "target_variable": "sort_buffer_size"
    }
  ],
  "executive_summary": "Query scans 2 tables, materializes 2 temp tables and sorts the result; examines ~4,008 rows to return 24 in 3.8 ms. Main finding: full scan of employees (2,000 rows).",
  "query": {
    "raw": "with `dept_avg` as (/* select#2 */ select `demodb`.`employees`.`dept_id` AS `dept_id`,avg(`demodb`.`employees`.`salary`) AS `avg_sal`,count(0) AS `n` from `demodb`.`employees` group by `demodb`.`employees`.`dept_id`), `top_paid` as (/* select#3 */ select `e`.`id` AS `id`,`e`.`name` AS `name`,`e`.`dept_id` AS `dept_id`,`e`.`salary` AS `salary`,row_number() OVER (PARTITION BY `demodb`.`e`.`dept_id` ORDER BY `demodb`.`e`.`salary` desc )  AS `rn` from `demodb`.`employees` `e`) /* select#1 */ select `d`.`name` AS `dept`,`da`.`avg_sal` AS `avg_sal`,`tp`.`name` AS `top_earner`,`tp`.`salary` AS `salary` from `demodb`.`departments` `d` join `dept_avg` `da` join `top_paid` `tp` where ((`tp`.`dept_id` = `d`.`id`) and (`da`.`dept_id` = `d`.`id`) and (`tp`.`rn` <= 3)) order by `da`.`avg_sal` desc",
    "beautified": "with dept_avg as (/*\nselect#2 */\nselect demodb.employees.dept_id AS dept_id,avg(demodb.employees.salary) AS avg_sal,count(0) AS n\nfrom demodb.employees\ngroup by demodb.employees.dept_id), top_paid as (/*\nselect#3 */\nselect e.id AS id,e.name AS name,e.dept_id AS dept_id,e.salary AS salary,row_number() OVER (PARTITION BY demodb.e.dept_id\nORDER BY demodb.e.salary desc ) AS rn\nfrom demodb.employees e) /*\nselect#1 */\nselect d.name AS dept,da.avg_sal AS avg_sal,tp.name AS top_earner,tp.salary AS salary\nfrom demodb.departments d\n  join dept_avg da\n  join top_paid tp\nwhere ((tp.dept_id = d.id) and (da.dept_id = d.id) and (tp.rn <= 3))\norder by da.avg_sal desc"
  },
  "primary_action": {
    "ref": "suggestions[0]"
  }
}
