{
  "schema_version": "1.2",
  "generated_at": "2026-04-23T23:04:52Z",
  "myflames_version": "1.4.0",
  "source": {
    "type": "file",
    "engine": "mysql",
    "fixture_path": "/Users/viniciusgrippa/Downloads/git/myflames/test/mysql-explain-index-merge-intersection.json"
  },
  "plan_summary": {
    "total_time_ms": 0.06,
    "rows_sent": 0,
    "rows_examined_estimate": 75,
    "operator_count": 4,
    "max_depth": 3
  },
  "optimizer_switches": [
    {
      "name": "index_merge",
      "value": "on",
      "explanation": "Uses two or more index range scans on the same table and combines row IDs (union/intersection/sort_union) instead of falling back to a full scan. A composite index is usually faster.",
      "node_labels": [
        "Intersect (row ID)"
      ]
    },
    {
      "name": "index_merge_intersection",
      "value": "on",
      "explanation": "Intersection variant: AND'ed predicates are satisfied by scanning each index and intersecting row IDs — useful when no single composite index covers both predicates.",
      "node_labels": [
        "Intersect (row ID)"
      ]
    }
  ],
  "warnings": [],
  "suggestions": [],
  "executive_summary": "Query runs 4 operators; returns 0 rows in 0.06 ms. No warnings.",
  "query": {
    "raw": "/* select#1 */ select `testdb`.`t1`.`id` AS `id`,`testdb`.`t1`.`a` AS `a`,`testdb`.`t1`.`b` AS `b`,`testdb`.`t1`.`c` AS `c`,`testdb`.`t1`.`d` AS `d` from `testdb`.`t1` where ((`testdb`.`t1`.`b` = 100) and (`testdb`.`t1`.`a` = 50))",
    "beautified": "select testdb.t1.id AS id,testdb.t1.a AS a,testdb.t1.b AS b,testdb.t1.c AS c,testdb.t1.d AS d\nfrom testdb.t1\nwhere ((testdb.t1.b = 100) and (testdb.t1.a = 50))"
  },
  "teach_hooks": [
    {
      "lesson": "filter",
      "match": {
        "folded_label": "FILTER (((t1.b = 100) and (t1.a = 50))) starts=1 rows=0",
        "short_label": "Filter: (((t1.b = 100) and (t1.a = 50)))"
      },
      "controls": {
        "input_rows": 1,
        "selectivity": 0.1
      },
      "note": "Filter: ((t1.b = 100) and (t1.a = 50))",
      "query_sql": "/* select#1 */ select `testdb`.`t1`.`id` AS `id`,`testdb`.`t1`.`a` AS `a`,`testdb`.`t1`.`b` AS `b`,`testdb`.`t1`.`c` AS `c`,`testdb`.`t1`.`d` AS `d` from `testdb`.`t1` where ((`testdb`.`t1`.`b` = 100) and (`testdb`.`t1`.`a` = 50))"
    },
    {
      "lesson": "non_unique_lookup",
      "match": {
        "folded_label": "INDEX RANGE SCAN [t1.idx_b] starts=1 rows=25",
        "short_label": "Index range scan [t1.idx_b]"
      },
      "controls": {
        "rows": 25,
        "selectivity": 40.0,
        "covering": false
      },
      "note": "Index range scan on t1 using idx_b over (b = 100) (t1)",
      "query_sql": "/* select#1 */ select `testdb`.`t1`.`id` AS `id`,`testdb`.`t1`.`a` AS `a`,`testdb`.`t1`.`b` AS `b`,`testdb`.`t1`.`c` AS `c`,`testdb`.`t1`.`d` AS `d` from `testdb`.`t1` where ((`testdb`.`t1`.`b` = 100) and (`testdb`.`t1`.`a` = 50))"
    },
    {
      "lesson": "non_unique_lookup",
      "match": {
        "folded_label": "INDEX RANGE SCAN [t1.idx_a] starts=1 rows=50",
        "short_label": "Index range scan [t1.idx_a]"
      },
      "controls": {
        "rows": 50,
        "selectivity": 40.0,
        "covering": false
      },
      "note": "Index range scan on t1 using idx_a over (a = 50) (t1)",
      "query_sql": "/* select#1 */ select `testdb`.`t1`.`id` AS `id`,`testdb`.`t1`.`a` AS `a`,`testdb`.`t1`.`b` AS `b`,`testdb`.`t1`.`c` AS `c`,`testdb`.`t1`.`d` AS `d` from `testdb`.`t1` where ((`testdb`.`t1`.`b` = 100) and (`testdb`.`t1`.`a` = 50))"
    }
  ],
  "operator_complexities": [
    {
      "folded_label": "Intersect rows sorted by row ID starts=1 rows=0",
      "short_label": "Intersect (row ID)",
      "complexity": {
        "big_o": "O(Σ kᵢ)",
        "short": "Σ kᵢ",
        "severity": "medium",
        "rationale": "Index merge (intersection): scans each index separately and intersects the sorted row-ID streams.",
        "confidence": "typical",
        "learn_more": "index_merge"
      }
    },
    {
      "folded_label": "INDEX RANGE SCAN [t1.idx_b] starts=1 rows=25",
      "short_label": "Index range scan [t1.idx_b]",
      "complexity": {
        "big_o": "O(log n + k)",
        "short": "log n + k",
        "severity": "good",
        "rationale": "Index range scan: one B+tree descent to the range start, then a sequential walk over k matching index entries.",
        "confidence": "exact",
        "learn_more": "index_range_scan"
      }
    },
    {
      "folded_label": "INDEX RANGE SCAN [t1.idx_a] starts=1 rows=50",
      "short_label": "Index range scan [t1.idx_a]",
      "complexity": {
        "big_o": "O(log n + k)",
        "short": "log n + k",
        "severity": "good",
        "rationale": "Index range scan: one B+tree descent to the range start, then a sequential walk over k matching index entries.",
        "confidence": "exact",
        "learn_more": "index_range_scan"
      }
    }
  ]
}
