{
  "schema_version": "1.0",
  "generated_at": "2026-04-10T20:09:14Z",
  "myflames_version": "1.2.0",
  "source": {
    "type": "file",
    "engine": "mysql",
    "fixture_path": "test/mysql-explain-complex-join.json"
  },
  "plan_summary": {
    "total_time_ms": 6357.23,
    "rows_sent": 9,
    "rows_examined_estimate": 331614,
    "operator_count": 10,
    "max_depth": 7
  },
  "optimizer_switches": [],
  "warnings": [
    {
      "severity": "warn",
      "category": "full_scan",
      "text": "Full table scan: <temporary> (9 rows), dept_emp (331603 rows)",
      "source": "plan",
      "node_labels": [
        "Table scan [<temporary>]",
        "Table scan [dept_emp]"
      ]
    },
    {
      "severity": "warn",
      "category": "filesort",
      "text": "1 sort operation(s) — 9 rows; may use disk-based filesort",
      "source": "plan",
      "node_labels": [
        "Sort"
      ]
    }
  ],
  "suggestions": [
    {
      "severity": "high",
      "category": "index",
      "action": "Add indexes on filter/join columns to avoid full table scans",
      "source": "plan"
    },
    {
      "severity": "medium",
      "category": "tuning_variable",
      "action": "Increase sort_buffer_size or add an ordered index to avoid filesort",
      "source": "plan",
      "target_variable": "sort_buffer_size"
    }
  ],
  "executive_summary": "Query scans 2 tables and sorts the result; examines ~331,614 rows to return 9 in 6357 ms. Main finding: full scan of dept_emp (331,603 rows).",
  "query": {
    "raw": "/* select#1 */ select `d`.`dept_name` AS `dept_name`,round(AVG(s.salary),2) AS `avg_salary` from `employees`.`salaries` `s` join `employees`.`dept_emp` `de` join `employees`.`departments` `d` where ((`s`.`emp_no` = `de`.`emp_no`) and (`d`.`dept_no` = `de`.`dept_no`) and (`de`.`to_date` = DATE'9999-01-01') and (`s`.`to_date` = DATE'9999-01-01')) group by `employees`.`d`.`dept_name` order by `avg_salary` desc",
    "beautified": "select d.dept_name AS dept_name,round(AVG(s.salary),2) AS avg_salary\nfrom employees.salaries s\n  join employees.dept_emp de\n  join employees.departments d\nwhere ((s.emp_no = de.emp_no) and (d.dept_no = de.dept_no) and (de.to_date = DATE'9999-01-01') and (s.to_date = DATE'9999-01-01'))\ngroup by employees.d.dept_name\norder by avg_salary desc"
  },
  "primary_action": {
    "ref": "suggestions[0]"
  }
}
